{"$id":"https://graphic-design-archive.local/schemas/exploration-action-response-v1","$schema":"https://json-schema.org/draft/2020-12/schema","additionalProperties":true,"properties":{"api_version":{"const":"trace-exploration/v1"},"associations":{"minItems":1,"type":"array"},"available_actions":{"items":{"minLength":1,"type":"string"},"type":"array","uniqueItems":true},"compositions":{"minItems":1,"type":"array"},"database_snapshot_id":{"minLength":1,"type":"string"},"default_focus":{"minLength":1,"type":"string"},"initial_state":{"$id":"https://graphic-design-archive.local/schemas/exploration-state-v1","$schema":"https://json-schema.org/draft/2020-12/schema","additionalProperties":false,"properties":{"api_version":{"const":"trace-exploration/v1"},"available_actions":{"items":{"enum":["SELECT_CATEGORY","FOCUS_NODE","EXPAND_NODE","COLLAPSE_NODE","MOVE_FOCUS","SELECT_COMPOSITION","RESET_CATEGORY","EXPORT_CURRENT_STATE"]},"type":"array","uniqueItems":true},"category_id":{"enum":["region","theme","medium","movement"]},"current_region_id":{"minLength":1,"type":"string"},"database_snapshot_id":{"minLength":1,"type":"string"},"expanded_node_ids":{"items":{"minLength":1,"type":"string"},"type":"array","uniqueItems":true},"exploration_state_id":{"minLength":1,"type":"string"},"focused_node_id":{"minLength":1,"type":"string"},"map_id":{"minLength":1,"type":"string"},"presentation_hash":{"pattern":"^[0-9a-f]{64}$","type":"string"},"schema_version":{"const":"trace-exploration-state-v1"},"selected_composition_id":{"minLength":1,"type":"string"},"semantic_hash":{"pattern":"^[0-9a-f]{64}$","type":"string"},"state_hash":{"pattern":"^[0-9a-f]{64}$","type":"string"},"visible_association_ids":{"items":{"minLength":1,"type":"string"},"type":"array","uniqueItems":true},"visible_node_ids":{"items":{"minLength":1,"type":"string"},"type":"array","uniqueItems":true}},"required":["exploration_state_id","category_id","map_id","current_region_id","focused_node_id","selected_composition_id","expanded_node_ids","visible_node_ids","visible_association_ids","available_actions","semantic_hash","presentation_hash","state_hash","database_snapshot_id","api_version"],"title":"exploration-state-v1","type":"object"},"map":{"type":"object"},"nodes":{"minItems":1,"type":"array"},"plain_text_tree":{"$id":"https://graphic-design-archive.local/schemas/plain-text-tree-v1","$schema":"https://json-schema.org/draft/2020-12/schema","additionalProperties":false,"properties":{"generic_association_only":{"const":true},"plain_text_tree":{"minLength":1,"type":"string"},"plain_text_tree_ascii":{"minLength":1,"type":"string"},"schema_version":{"const":"trace-plain-text-tree-v1"},"structural_hierarchy_is_historical_claim":{"const":false},"tree_association_ids":{"items":{"minLength":1,"type":"string"},"type":"array","uniqueItems":true},"tree_node_ids":{"items":{"minLength":1,"type":"string"},"type":"array","uniqueItems":true},"tree_root_node_id":{"minLength":1,"type":"string"},"tree_semantic_hash":{"pattern":"^[0-9a-f]{64}$","type":"string"}},"required":["plain_text_tree","plain_text_tree_ascii","tree_root_node_id","tree_node_ids","tree_association_ids","tree_semantic_hash"],"title":"plain-text-tree-v1","type":"object"},"provenance_summary":{"type":"object"},"regions":{"minItems":1,"type":"array"},"semantic_hash":{"pattern":"^[0-9a-f]{64}$","type":"string"},"state":{"$id":"https://graphic-design-archive.local/schemas/exploration-state-v1","$schema":"https://json-schema.org/draft/2020-12/schema","additionalProperties":false,"properties":{"api_version":{"const":"trace-exploration/v1"},"available_actions":{"items":{"enum":["SELECT_CATEGORY","FOCUS_NODE","EXPAND_NODE","COLLAPSE_NODE","MOVE_FOCUS","SELECT_COMPOSITION","RESET_CATEGORY","EXPORT_CURRENT_STATE"]},"type":"array","uniqueItems":true},"category_id":{"enum":["region","theme","medium","movement"]},"current_region_id":{"minLength":1,"type":"string"},"database_snapshot_id":{"minLength":1,"type":"string"},"expanded_node_ids":{"items":{"minLength":1,"type":"string"},"type":"array","uniqueItems":true},"exploration_state_id":{"minLength":1,"type":"string"},"focused_node_id":{"minLength":1,"type":"string"},"map_id":{"minLength":1,"type":"string"},"presentation_hash":{"pattern":"^[0-9a-f]{64}$","type":"string"},"schema_version":{"const":"trace-exploration-state-v1"},"selected_composition_id":{"minLength":1,"type":"string"},"semantic_hash":{"pattern":"^[0-9a-f]{64}$","type":"string"},"state_hash":{"pattern":"^[0-9a-f]{64}$","type":"string"},"visible_association_ids":{"items":{"minLength":1,"type":"string"},"type":"array","uniqueItems":true},"visible_node_ids":{"items":{"minLength":1,"type":"string"},"type":"array","uniqueItems":true}},"required":["exploration_state_id","category_id","map_id","current_region_id","focused_node_id","selected_composition_id","expanded_node_ids","visible_node_ids","visible_association_ids","available_actions","semantic_hash","presentation_hash","state_hash","database_snapshot_id","api_version"],"title":"exploration-state-v1","type":"object"},"state_hash":{"pattern":"^[0-9a-f]{64}$","type":"string"}},"required":["api_version","database_snapshot_id","map","regions","nodes","associations","compositions","default_focus","available_actions","plain_text_tree","provenance_summary","semantic_hash","state_hash"],"title":"exploration-action-response-v1","type":"object"}
