{"api_version":"trace-exploration/v1","associations":[{"active_for_proximity":true,"association_accessible_description":"production is available to explore with mediation as a qualified generic association.","association_id":"R14-ASSOC-002","confidence":"HIGH","endpoint_labels":["production","mediation"],"endpoint_vocabulary_ids":["TRV:ab8e18ef4ebebeddc0b3152ce9c9006e14fc05242e3fc9ce32246ea6a9543074","TRV:9e44dae2c5ca8dc916878b28f5ec3720e42ea22d2add139759780727e6f487ce"],"explicit_non_claims":["causation","influence","chronology","hierarchy","direction","equivalence"],"generic_association_only":true,"hard_negative":false,"mandatory_dimension_results":{"D1":2,"D5":1,"D7":2},"provenance_refs":["R14-EVID-002-01","R14-EVID-002-02","R14-EVID-002-03"],"qualification":"Mediation is contextual, not a causal arrow from production.","qualification_version":"trace-generic-association-rubric-v1","source_refs":["COMP-SRC-009","COMP-SRC-010"],"source_urls":["https://academic.oup.com/jdh/article/39/2/113/8537083","https://doi.org/10.1093/jdh/epp031"],"strength":"STRONG","support_status":"EXTERNALLY_SUPPORTED"},{"active_for_proximity":true,"association_accessible_description":"mediation is available to explore with consumption as a qualified generic association.","association_id":"R14-ASSOC-003","confidence":"HIGH","endpoint_labels":["mediation","consumption"],"endpoint_vocabulary_ids":["TRV:9e44dae2c5ca8dc916878b28f5ec3720e42ea22d2add139759780727e6f487ce","TRV:ad8c6f6e417a6d2db992c155701ed13494624142922d58eda2e4ad0fa4672fa8"],"explicit_non_claims":["causation","influence","chronology","hierarchy","direction","equivalence"],"generic_association_only":true,"hard_negative":false,"mandatory_dimension_results":{"D1":2,"D5":1,"D7":2},"provenance_refs":["R14-EVID-003-01","R14-EVID-003-02","R14-EVID-003-03"],"qualification":"The association does not make consumers passive endpoints.","qualification_version":"trace-generic-association-rubric-v1","source_refs":["COMP-SRC-009","COMP-SRC-010"],"source_urls":["https://academic.oup.com/jdh/article/39/2/113/8537083","https://doi.org/10.1093/jdh/epp031"],"strength":"STRONG","support_status":"EXTERNALLY_SUPPORTED"},{"active_for_proximity":true,"association_accessible_description":"production is available to explore with consumption as a qualified generic association.","association_id":"R14-ASSOC-004","confidence":"HIGH","endpoint_labels":["production","consumption"],"endpoint_vocabulary_ids":["TRV:ab8e18ef4ebebeddc0b3152ce9c9006e14fc05242e3fc9ce32246ea6a9543074","TRV:ad8c6f6e417a6d2db992c155701ed13494624142922d58eda2e4ad0fa4672fa8"],"explicit_non_claims":["causation","influence","chronology","hierarchy","direction","equivalence"],"generic_association_only":true,"hard_negative":false,"mandatory_dimension_results":{"D1":2,"D5":1,"D7":2},"provenance_refs":["R14-EVID-004-01","R14-EVID-004-02","R14-EVID-004-03"],"qualification":"Spatial association does not assert a single linear market mechanism.","qualification_version":"trace-generic-association-rubric-v1","source_refs":["COMP-SRC-009","COMP-SRC-010"],"source_urls":["https://academic.oup.com/jdh/article/39/2/113/8537083","https://doi.org/10.1093/jdh/epp031"],"strength":"STRONG","support_status":"EXTERNALLY_SUPPORTED"},{"active_for_proximity":true,"association_accessible_description":"exhibition is available to explore with design diplomacy as a qualified generic association.","association_id":"R14-ASSOC-005","confidence":"HIGH","endpoint_labels":["exhibition","design diplomacy"],"endpoint_vocabulary_ids":["TRV:83a2bff84b1d599d9eed884a09666501c96224a0b3b7457699ef0be145e76e73","TRV:303eafd7c2afb63e99e140c4ba2abd1de5f78f9e8ebbb3040b4531b6df568639"],"explicit_non_claims":["causation","influence","chronology","hierarchy","direction","equivalence"],"generic_association_only":true,"hard_negative":false,"mandatory_dimension_results":{"D1":2,"D5":2,"D7":2},"provenance_refs":["R14-EVID-005-01","R14-EVID-005-02","R14-EVID-005-03"],"qualification":"Diplomatic intention does not guarantee audience reception or political effect.","qualification_version":"trace-generic-association-rubric-v1","source_refs":["COMP-SRC-023","COMP-SRC-024","COMP-SRC-025"],"source_urls":["https://doi.org/10.1080/10331867.2023.2282294","https://www.cambridge.org/core/journals/contemporary-european-history/article/socialist-humanist-and-welldesigned-the-polish-welfare-state-at-the-international-labour-exhibition-in-turin-1961/94D125A40C5B3B013872B9A949430909","https://www.tandfonline.com/doi/abs/10.1080/17547075.2017.1333388"],"strength":"STRONG","support_status":"EXTERNALLY_SUPPORTED"},{"active_for_proximity":true,"association_accessible_description":"design diplomacy is available to explore with propaganda as a qualified generic association.","association_id":"R14-ASSOC-006","confidence":"HIGH","endpoint_labels":["design diplomacy","propaganda"],"endpoint_vocabulary_ids":["TRV:303eafd7c2afb63e99e140c4ba2abd1de5f78f9e8ebbb3040b4531b6df568639","TRV:c82d3d4865e41e2a263ff0427c4df2b8e3e43a85c835404d033d764468b3ba55"],"explicit_non_claims":["causation","influence","chronology","hierarchy","direction","equivalence"],"generic_association_only":true,"hard_negative":false,"mandatory_dimension_results":{"D1":2,"D5":2,"D7":2},"provenance_refs":["R14-EVID-006-01","R14-EVID-006-02","R14-EVID-006-03"],"qualification":"The sources distinguish diplomacy from propaganda rather than equating them.","qualification_version":"trace-generic-association-rubric-v1","source_refs":["COMP-SRC-023","COMP-SRC-024","COMP-SRC-025"],"source_urls":["https://doi.org/10.1080/10331867.2023.2282294","https://www.cambridge.org/core/journals/contemporary-european-history/article/socialist-humanist-and-welldesigned-the-polish-welfare-state-at-the-international-labour-exhibition-in-turin-1961/94D125A40C5B3B013872B9A949430909","https://www.tandfonline.com/doi/abs/10.1080/17547075.2017.1333388"],"strength":"STRONG","support_status":"EXTERNALLY_SUPPORTED"},{"active_for_proximity":true,"association_accessible_description":"propaganda is available to explore with trade as a qualified generic association.","association_id":"R14-ASSOC-007","confidence":"MODERATE","endpoint_labels":["propaganda","trade"],"endpoint_vocabulary_ids":["TRV:c82d3d4865e41e2a263ff0427c4df2b8e3e43a85c835404d033d764468b3ba55","TRV:276446ba01e3aa387c83b06f54fccc5ac65bdc6099157a2a828716eac9c6fd4d"],"explicit_non_claims":["causation","influence","chronology","hierarchy","direction","equivalence"],"generic_association_only":true,"hard_negative":false,"mandatory_dimension_results":{"D1":2,"D5":2,"D7":2},"provenance_refs":["R14-EVID-007-01"],"qualification":"One bounded exposition case; no general identity between propaganda and trade.","qualification_version":"trace-generic-association-rubric-v1","source_refs":["COMP-SRC-025"],"source_urls":["https://doi.org/10.1080/10331867.2023.2282294"],"strength":"STRONG","support_status":"EXTERNALLY_SUPPORTED"},{"active_for_proximity":true,"association_accessible_description":"exhibition is available to explore with propaganda as a qualified generic association.","association_id":"R14-ASSOC-008","confidence":"HIGH","endpoint_labels":["exhibition","propaganda"],"endpoint_vocabulary_ids":["TRV:83a2bff84b1d599d9eed884a09666501c96224a0b3b7457699ef0be145e76e73","TRV:c82d3d4865e41e2a263ff0427c4df2b8e3e43a85c835404d033d764468b3ba55"],"explicit_non_claims":["causation","influence","chronology","hierarchy","direction","equivalence"],"generic_association_only":true,"hard_negative":false,"mandatory_dimension_results":{"D1":2,"D5":2,"D7":2},"provenance_refs":["R14-EVID-008-01","R14-EVID-008-02"],"qualification":"The assessment remains case-bounded and does not classify every exhibition as propaganda.","qualification_version":"trace-generic-association-rubric-v1","source_refs":["COMP-SRC-024","COMP-SRC-025"],"source_urls":["https://doi.org/10.1080/10331867.2023.2282294","https://www.cambridge.org/core/journals/contemporary-european-history/article/socialist-humanist-and-welldesigned-the-polish-welfare-state-at-the-international-labour-exhibition-in-turin-1961/94D125A40C5B3B013872B9A949430909"],"strength":"STRONG","support_status":"EXTERNALLY_SUPPORTED"},{"active_for_proximity":true,"association_accessible_description":"design diplomacy is available to explore with trade as a qualified generic association.","association_id":"R14-ASSOC-009","confidence":"MODERATE","endpoint_labels":["design diplomacy","trade"],"endpoint_vocabulary_ids":["TRV:303eafd7c2afb63e99e140c4ba2abd1de5f78f9e8ebbb3040b4531b6df568639","TRV:276446ba01e3aa387c83b06f54fccc5ac65bdc6099157a2a828716eac9c6fd4d"],"explicit_non_claims":["causation","influence","chronology","hierarchy","direction","equivalence"],"generic_association_only":true,"hard_negative":false,"mandatory_dimension_results":{"D1":2,"D5":2,"D7":2},"provenance_refs":["R14-EVID-009-01"],"qualification":"Single-case source support; diplomatic outcome is not asserted.","qualification_version":"trace-generic-association-rubric-v1","source_refs":["COMP-SRC-025"],"source_urls":["https://doi.org/10.1080/10331867.2023.2282294"],"strength":"STRONG","support_status":"EXTERNALLY_SUPPORTED"},{"active_for_proximity":true,"association_accessible_description":"advertising is available to explore with consumer culture as a qualified generic association.","association_id":"R14-ASSOC-019","confidence":"MODERATE","endpoint_labels":["advertising","consumer culture"],"endpoint_vocabulary_ids":["TRV:d27a4a1080657098835b014b8f47529c5be746cb60b043fb2400fec1a6948185","TRV:12c360cc0c3231a45d5841e63ee7f3377be76ee0fa28c3f4dda803186cbbc829"],"explicit_non_claims":["causation","influence","chronology","hierarchy","direction","equivalence"],"generic_association_only":true,"hard_negative":false,"mandatory_dimension_results":{"D1":2,"D5":2,"D7":1},"provenance_refs":["R14-EVID-019-01","R14-EVID-019-02"],"qualification":"Supported by archive/source evidence. Independent scholarly validation pending.","qualification_version":"trace-generic